Question,Answer
How long does my community garden permit last through ,The maximum duration of the preformance period is ten years from the date of execution
Will my garden have preformance reviews,"Yes, RAP will hold a series of annual performance review which shall include a compliance with terms and conditions, maintenece of the property, fufillment of performance requirements, Adequacy of funding, cooperation with LA city staff, and proper participation"
How do I go about performance reviews,"submit to RAP a performance report that includes Annual Budget, participation data, discussion of program challenges in the period of Feburary first through May thirtieth"
What are the general requirements and restrictions ,"PROPERTIES may be used for meetings related to the operation and maintenance of a community garden. b. The public will be allowed access for public programs, tours of the garden and during special events; scheduled school tours and field trips will be conducted by a registered and fingerprinted employee or volunteer of LACGC. LACGC shall ensure that any employee and/or volunteer, is appropriately evaluated pursuant to normal CITY background check procedures for RAP volunteers. c. No commercial activity will be allowed on the PROPERTIES. d. Grown and harvested fruit and vegetation are for personal consumption and may not be used for for-profit commercial purposes. e. PROPERTIES shall not be permitted to be used for organized sports, public event space, or paid parking. LACGC shall ensure that no photographs of minors or depiction of their likeness is included in any publication without obtaining prior written consent from the child’s parent or legal guardian. The documentation of this written consent must be provided to RAP prior to photographs being taken. f. g. The dispensing and/or consumption of beer, wine or other intoxicating liquors (commonly referred to alcoholic beverages) shall not be permitted to occur on the PROPERTIES"
What hours of the day am I permitted to use the garden,Sunrise to sunset daily for the operation and maintenance of community gardens. Any extended times or hours for specified events or programs related to a community garden may be granted with prior written consent of CITY
"Can I park for free, how does parking work","LACGC, its staff, and public patrons and/or guests, whether or not involved in LACGC activities at the PROPERTIES, shall have the non-exclusive right without charge, to park vehicles within any available parking spaces at the PROPERTIES on a first-come-first-served basis. Exclusive or designated parking shall not be allowed. Off-site street parking is allowed, subject to the Department of Transportation regulations."
Can we do fundraising for our garden,"must obtain prior written approval for the date and time from RAP contact person set forth in Notices Section 24 for each fundraising event no fewer than thirty (30) calendar days prior to the scheduled activity. LACGC may have no more than four (4) fundraising events per year with a maximum of one (1) fundraising event per quarter. All monies raised from fundraising conducted at the PROPERTIES must be used only in support of the activities authorized under this AGREEMENT. Within thirty (30) days of each fundraising event held at the PROPERTIES, LACGC shall provide a written balance statement for the event that shall detail expenses and revenues, including net funds raised. Fundraising activities shall not include the distribution and/or the consumption of alcoholic beverages in accordance with Section 5.g."
How does billing and costs of utilities work,"the cost of utility services to the PROPERTIES, such as electricity, gas, and water, shall be the sole financial responsibility of the organization operating and maintaining the subject facility. With respect to the PROPERTIES under this AGREEMENT. RAP shall invoice LACGC semi-annually for actual water use based on a water
sub-meter installed at the PROPERTIES. Payment for each six month billing period
(January-June and July-December) will be made by LACGC in a lump sum within thirty
(30) calendar days of receipt of an invoice from RAP. Payments may be made by check
or money order made payable to “City of Los Angeles, Department of Recreation and
Parks” and mailed to the RAP Partnership Division at the address listed in Section 24 of
this AGREEMENT."
What is the trash and solid waste disposal policy,"Trash disposal and removal of solid waste, green waste and recyclables shall be the sole responsibility and expense of LACGC. CITY shall bear no costs in regards to the disposal and /or removal of trash, solid waste and green waste."
"what if I want to make alterations, improvements or replacements at my garden","Submit a project proposal for RAP review and presentation for conceptual approval by the BOARD, if necessary. The proposal should include but not be limited to, project objectives, conceptual drawings, a written description of the project’s scope of work, general project details and requirements, and estimated preliminary budget. a. Should the project be conceptually approved by the BOARD, LACGC will be authorized to perform any required preliminary work or site assessments, either through a right-ofentry permit if required, or the CITY’s authority and/or this AGREEMENT. b. Depending on the scope of work and magnitude of the proposed project, LACGC may be assessed an administrative fee to be determined by RAP, for project review and all c. Agreement No. services provided by CITY staff. Such fee shall be paid to the “City of Los Angeles Department of Recreation and Parks” and shall have been paid in full prior to CITY conceptual approval of the proposed project. d. If necessary and pursuant to the recommendation of the City Attorney, a development agreement shall be prepared to set forth the terms and conditions under which the proposed project shall be implemented, depending on the scope of work and project magnitude. e. When prepared, LACGC shall submit 50% and 90% complete design drawings for RAP review and approval. Upon RAP’s approval, all design and architectural work shall be completed by a California licensed architect and/engineer. PARTIES shall submit a proposed development agreement and final plans and specifications, respectively, to the BOARD for its consideration and final project approval. f. g. LACGC shall obtain, at its own cost and expense, all necessary and/or required City, County, State, and/or Federal permits, approvals, licenses, and/or authorizations for project implementation, including but not limited to environmental clearances, in compliance with the California Environmental Quality Act (CEQA). h. LACGC shall submit approved plans and specifications for final approval to: Assistant General Manager, Planning, Maintenance and Construction Branch City of Los Angeles Department of Recreation and Parks 221 N. Figueroa Street, Suite 400, Los Angeles, CA 90012 i. Upon receipt of final approval, LACGC may commence construction in coordination with CITY staff."
What insurance documentation must LACGC provide before occupying the PROPERTIES under the AGREEMENT?,LACGC must furnish CITY with evidence of insurance from firms reasonably acceptable to CITY and approved to do such business in the State of California.
Who should LACGC name as an additional insured for all required coverages?,"LACGC or any third party providing work or services under the AGREEMENT should name the City of Los Angeles and its boards, officers, agencies, and employees as an additional insured for all required coverages."
Who is responsible for maintaining all insurance at their sole cost and expense throughout the TERM of the AGREEMENT?,LACGC is responsible for maintaining all such insurance at its sole cost and expense throughout the TERM of the AGREEMENT.
What should LACGC do if any of the required insurance contains aggregate limits or applies to other operations outside of the AGREEMENT?,"LACGC should give CITY written notice of any incident, occurrence, claim, settlement, or judgment against such insurance within thirty (30) calendar days of knowledge. LACGC should further restore such aggregate limits or provide other replacement insurance within sixty (60) calendar days of knowledge."
: What is the consequence of LACGC's failure to procure and maintain the required insurance?,"LACGC's failure to procure and maintain the required insurance shall constitute a material breach of the AGREEMENT under which CITY may immediately terminate the AGREEMENT or, at its discretion, pay to procure or renew such insurance to protect CITY’s interest; in which case LACGC agrees to reimburse CITY for all money so paid."
 What is required for self-insurance programs and self-insured retention in insurance policies?,"Self-insurance programs and self-insured retention in insurance policies are subject to separate approval by CITY upon review of evidence of LACGC’s financial capacity. Additionally, such programs or retention must provide CITY with an equivalent protection from liability."
What taxes is LACGC responsible for under the agreement?,"LACGC is responsible for paying all taxes levied on the rights to use the properties, as well as taxes on improvements, fixtures, equipment, or other property on the premises."
How are taxes on LACGC's operations addressed in the agreement?,Taxes on LACGC's operations are addressed by specifying that LACGC shall pay all taxes related to its use of the properties and any improvements or operations conducted thereunder.
What are the required documents needed to provide to RAP,Exhibit A: List of Properties used by Los Angeles Community Garden Council and a Site Map for each Property Exhibit B: Sample Performance Evaluation Form Exhibit C: Sample Garden Rules for a Community Garden Exhibit D: Insurance Requirements Exhibit E: Standard Provisions for City Contracts (Rev. 3/09)
What is the code of conduct for gardners,"Gardeners may access the garden from sunrise to sundown daily, yearround. Gardeners are responsible for locking the gate behind them. Keys and combinations are strictly for personal use and must not be shared with others. days of the plot being assigned. 1. 2. Gardeners must plant their plot within They must garden year-round. If gardeners are unable to tend the plot due to illness or traveling, they must arrange for someone else to tend the plot and notify the Garden Leadership Team. 3. Gardeners must keep their plot, paths, and surrounding areas around their plot clean and free of trash, weeds, and debris. They must keep the plot free of weeds, pests, and diseases. Because of the communal nature of a community garden, this is necessary to control against invasions of the whole garden. 4. Plot boundaries are clearly defined and plants must remain with the boundaries of each plot. Gardeners may not plant trees in their plots or any plants higher than 5. feet. Gardeners must not apply any pesticides, insecticides or herbicides in the garden without approval from the Garden Leadership team. Organic gardening promotes the health of our produce, soil, and fellow gardeners. 6. Gardeners are responsible for taking any trash or recyclables that they generate with them out of the garden. ~ Tools must be returned to their proper location after use to keep the garden and toolsheds in a neat condition. Gardeners are responsible for locking the toolsheds. If a tool is missing, damaged or broken, inform a member of the Garden Leadership Team immediately. Gardeners may be held responsible for damaged or broken items or equipment and they may not be replaced if missing or broken. Please conserve water and use a trigger-operated nozzle on the hose 7. 8. as required by California law. Notify the Garden Leadership Team of any leaks. Maintain your raised bed to conserve water. Agreement No.____ 9. All water hoses are to be left coiled near the water spigots. 10. Gardeners may be required to contribute some time each month to maintain the communal areas of the garden."
Why start a community garden?,"Many families living in the city would like to grow some of their own fruits, vegetables, herbs, and flowers. Some want to save money on their food bills. Others like the freshness, flavor and wholesomeness of home-grown produce. And for many, gardening is a relaxing way to exercise and enjoy being out-of-doors. There are also families from other cultures who would like to grow traditional foods not available in the supermarket. Community gardens beautify neighborhoods and help bring neighbors closer together. They have been proven as tools to reduce neighborhood crime--particularly when vacant, blighted lots are targeted for garden development. Community gardens provide safe, recreational green space in urban areas with little or no park land, and can contribute greatly to keeping urban air clean. Those who are lucky enough to have sunny backyards or balconies can plant a garden whenever they have the time and energy. But what about those who do not have a place to garden? For these people, community gardens may be the answer."
What makes a good potential spot for a garden,"A garden site should be relatively flat (although slight slopes can be terraced). It should be relatively free of large pieces of concrete left behind from demolition of structures. Any rubble or debris should be manageable--that is, it can be removed by volunteers clearing the lot with trash bags, wheelbarrows, and pick up trucks. Ideally, it should have a fence around it with a gate wide enough for a vehicle to enter. It is possible to work with a site that is paved with concrete or asphalt by building raised beds that sit on the surface or using containers. You can also remove the asphalt or concrete to create areas for gardens, but such a garden will be much more difficult, expensive, and time-consuming to start. A site without paving, and soil relatively free of trash and debris is best. The potential garden site should be within walking, or no more than a short drive from you and the neighbors who have expressed interest in participating. If the lot is not already being used, make sure the community supports establishing a garden there. It's best to select three potential sites in your neighborhood and write down their address and nearest cross streets. If you don't know the address of a vacant lot, get the addresses of the properties on both sides of the lot--this will give you the ability to make an educated guess on the address of the site. We suggest you identify at least three potential sites because one or more might not be available for you to use for various reasons, and you want to end up with at least one that works out."
What if I don’t own the land?,"Once you have determined that your potential site is feasible, write a letter to the landowner asking for permission to use the
property for a community garden. Be sure to mention to the landowner the The Urban Agriculture Incentive Zones (UAIZ) Program. This program provides vacant property owners a tax reduction to use their land for community gardens or urban farms. This unique program brings together property owners and food growers to make Los Angeles communities healthier and more sustainable. A property owner can either lease their land to community members looking to grow food or grow on their own to receive the tax break. We want to make sure Angelenos take advantage of this opportunity! It’s a win-win for property owners, growers, and communities"
How do I avoid lawsuits and liabilities regaurding injuries? ,"
Landowners of potential garden sites might be concerned about their liability should someone be injured while working in the garden. Your group should be prepared to offer the landowner a lease with a ""hold harmless"" waiver. This ""hold harmless"" waiver can simply state that should one of the gardeners be injured as a result of negligence on the part of another gardener, the landowner is ""held harmless"" and will not be sued. Each gardener should be made aware of this waiver and should be required to sign an 3 agreement in order to obtain a plot in the community garden. A sample gardener agreement form is attached which your group can use as a model."
What are the basic elements of a community garden? ,"At least 15 plots assigned to community members. These should be placed in the sunniest part of the garden. Without plots for individual participation, it is very difficult to achieve long-term community involvement. Raised bed plots, which are more expensive, should be no more than 4 feet wide (to facilitate access to plants from the sides without stepping into the bed), and between 8 and 12 feet long (it is advisable to construct your raised beds in sizes that are found in readily-available lumber, or that can be cut without too much waste). In-ground plots can be from 10 x 10 up to 20 x 20 feet. Pathways between beds and plots should be least 3 to 4 feet wide to allow space for wheelbarrows. The soil in both raised bed and in-ground plots should be amended with aged compost or manure to improve its fertility and increase its organic matter content. • A simple irrigation system with one hose bib or faucet for every four plots. Hand watering with a hose is the most practical and affordable for individual plots (and it's almost a necessity when you start plants from seed). Drip and soaker-hose irrigation can be used in all areas of the garden for transplanted and established plants, but especially for deep-rooted fruit trees and ornamentals. If no one in your group is knowledgeable about irrigation, you might need some assistance in designing your irrigation system. Seek out a landscape contractor or nursery or garden center professional to help you develop a basic layout and materials list. • An 8-foot fence around the perimeter with a drive-through gate. In our experience, this is a key element of success. Don't count on eliminating all acts of vandalism or theft, but fencing will help to keep these to tolerably low levels. • A tool shed or other structure for storing tools, supplies, and materials. Recycled metal shipping containers make excellent storage sheds, and are almost vandal-proof. Contact the Port Authority for leads on where to find them. • A bench or picnic table where gardeners can sit, relax, and take a break--preferably in shade. If there are no shade trees on the site, a simple arbor can be constructed from wood or pipe, and planted with chayote squash, bougainvillea, grapes, kiwis, or some other vine. • A sign with the garden's name, sponsors, and a contact person's phone number for more information. If your community is bilingual, include information in this language. • A shared composting area for the community gardeners. Wood pallets are easy to come-by and (when stood on-end, attached in a U-shape, and the inside covered with galvanized rabbit-wire) make excellent compost bins."
what are some nice additions I can make to my garden,"A small fruit tree orchard, whose care and harvest can be shared by all the members. The orchard can also create shade for people as well as shade-loving plants. • A water fountain. This can be a simple drinking fountain attachment to a hose bib (or faucet) you can purchase at a hardware store. • Perimeter landscaping, which can focus on drought tolerant flowers and shrubs, plants which attract butterflies and hummingbirds, or roses and other flowers suitable for cutting bouquets. Herbs are also well-suited to perimeter landscaping and help to create barriers to unwanted pest insects who do not like the smell of their essential oils. • A children's area, which can include special small plots for children, a sand box, and play equipment. • A meeting area, which could range from a semi-circle of hay bales or tree stumps, to a simple amphitheater built of recycled, broken concrete. Building a shade structure above would be beneficial as well. 4 • A community bulletin board where rules, meeting notices, and other important information can be posted"
How do I create a garden budget?,"Use your design to develop a materials list and cost-out the project. You will need to call-around to get prices on fencing and other items. You might be surprised at the cost. A community garden with just the Basic Elements (listed above) typically costs between $2,500 to $5,000. At this point, your group might decide to scale back your initial plans and save some design ideas for a ""Phase Two"" of the garden."
how do I get materials and money,"While some start-up funds will be needed through determination and hard work, you can obtain donations of materials for your project. Community businesses might assist, and provide anything from fencing to lumber to plants. The important thing is to ask. Develop a letter that tells merchants about your project and why it's important to the community. Attach your ""wish list"", but be reasonable. Try to personalize this letter for each business you approach. Drop it off personally with the store manager, preferably with a couple of cute kids who will be gardening in tow! Then, follow-up by phone. Be patient, persistent, and polite. Your efforts will pay-off with at least some of the businesses you approach. Be sure to thank these key supporters and recognize them on your garden sign, at a garden grand opening, or other special event. Money, which will be needed to purchase items not donated, can be obtained through community fund-raisers such as car washes, craft and rummage sales, pancake breakfasts, and bake sales. They can also be obtained by writing grants, but be aware grant writing efforts can take six months or longer to yield results, and you must have a fiscal sponsor or agent with tax-exempt 501(c)3 status (such as a church or non-profit corporation) that agrees to administer the funds."
how do I handle issues like vandalism,"Most gardens experience occasional vandalism. The best action you can take is to replant immediately. Generally the vandals become bored after a while and stop. Good community outreach, especially to youth and the garden's immediately neighbors is also important. Most important--don't get to discouraged. It happens. Get over it and keep going. What about barbed wired or razor wire to make the garden more secure? Our advice--don't. It's bad for community relations, looks awful, and is sometimes illegal to install without a permit. If you need more physic"
how do I handle gardner droping out and lack of participation?,"There has been, and probably always will be, a high rate of turnover in community gardens. Often, people sign up for plots and then don't follow through. Remember, gardening is hard work for some people, especially in the heat of summer. Be sure to have a clause in your gardener agreement which states gardeners forfeit their right to their plot if they don't plant it within one month, or if they don't maintain it. While gardeners should be given every opportunity to follow through, if after several reminders either by letter or phone nothing changes, it is time for the club to reassign the plot. It is also advisable that every year, the leadership conduct a renewed community outreach campaign by contacting churches and other groups in the neighborhood to let them know about the garden and that plots are available."
